{
  "profile_id": "GEN-INST-STRENGTH",
  "profile_kind": "instance",
  "inherits": "GEN-TYPE-ANALYTICAL",
  "inherit_arrays": "replace",
  "generator_version": "1.0.0",
  "package_id": "bz_01_strength_core",
  "package_name": "Strength Knowledge Package — Core Foundation",
  "package_type": "analytical",
  "package_version": "1.2.0",
  "domain": {
    "domain_id": "DOM-STRENGTH",
    "parent_domain": "DOM-BAZI"
  },
  "taxonomy": {
    "taxonomy_version": "1.0.0",
    "source": "knowledge/taxonomy/",
    "classifications": ["domain", "category", "type", "school", "language"]
  },
  "ontology": {
    "ontology_version": "1.0.0",
    "source": "knowledge/ontology/",
    "concepts": ["ONT-ANALYTICAL_KNOWLEDGE", "ONT-RULE"]
  },
  "target_rule_count": {
    "minimum": 80,
    "recommended": 110,
    "maximum": 120,
    "target": 110
  },
  "evidence_required": true,
  "reasoning_required": true,
  "example_required": true,
  "validation_profile": "PVP-RELEASE",
  "quality_target": "gold",
  "rule_id_prefix": "SKC",
  "language": "vi",
  "languages": ["vi"],
  "school": "bazi_default",
  "category_id": "core",
  "components": {
    "rules": {"required": true, "folder": "rules/", "standard": "KX-1A"},
    "evidence": {"required": true, "folder": "evidence/", "standard": "KX-1B"},
    "reasoning": {"required": true, "folder": "reasoning/", "standard": "KX-1C"},
    "examples": {"required": true, "folder": "examples/", "standard": "KX-1C conclusion classes"},
    "tests": {"required": true, "folder": "tests/", "standard": "package-local"},
    "documentation": {"required": true, "folder": "documentation/", "standard": "KD-3"}
  },
  "dependencies": {
    "required": [],
    "optional": [],
    "conflicts": []
  },
  "notes": "RETROSPECTIVE profile documenting how Strength Core maps onto Generator v1.0. Do NOT regenerate or modify knowledge/packages/strength/core/. Future Strength versions or sibling packs MUST start from this profile without mutating the released artifact."
}
